{
  "dep": [
    {"code": "01", "label": "Ain"},
    {"code": "02", "label": "Aisne"},
    {"code": "03", "label": "Allier"},
    {"code": "04", "label": "Alpes-de-Haute-Provence"},
    {"code": "05", "label": "Hautes-Alpes"},
    {"code": "06", "label": "Alpes-Maritimes"},
    {"code": "07", "label": "Ardèche"},
    {"code": "08", "label": "Ardennes"},
    {"code": "09", "label": "Ariège"},
    {"code": "10", "label": "Aube"},
    {"code": "11", "label": "Aude"},
    {"code": "12", "label": "Aveyron"},
    {"code": "13", "label": "Bouches-du-Rhône"},
    {"code": "14", "label": "Calvados"},
    {"code": "15", "label": "Cantal"},
    {"code": "16", "label": "Charente"},
    {"code": "17", "label": "Charente-Maritime"},
    {"code": "18", "label": "Cher"},
    {"code": "19", "label": "Corrèze"},
    {"code": "21", "label": "Côte-d'Or"},
    {"code": "22", "label": "Côtes-d'Armor"},
    {"code": "23", "label": "Creuse"},
    {"code": "24", "label": "Dordogne"},
    {"code": "25", "label": "Doubs"},
    {"code": "26", "label": "Drôme"},
    {"code": "27", "label": "Eure"},
    {"code": "28", "label": "Eure-et-Loir"},
    {"code": "29", "label": "Finistère"},
    {"code": "2A", "label": "Corse-du-Sud"},
    {"code": "2B", "label": "Haute-Corse"},
    {"code": "30", "label": "Gard"},
    {"code": "31", "label": "Haute-Garonne"},
    {"code": "32", "label": "Gers"},
    {"code": "33", "label": "Gironde"},
    {"code": "34", "label": "Hérault"},
    {"code": "35", "label": "Ille-et-Vilaine"},
    {"code": "36", "label": "Indre"},
    {"code": "37", "label": "Indre-et-Loire"},
    {"code": "38", "label": "Isère"},
    {"code": "39", "label": "Jura"},
    {"code": "40", "label": "Landes"},
    {"code": "41", "label": "Loir-et-Cher"},
    {"code": "42", "label": "Loire"},
    {"code": "43", "label": "Haute-Loire"},
    {"code": "44", "label": "Loire-Atlantique"},
    {"code": "45", "label": "Loiret"},
    {"code": "46", "label": "Lot"},
    {"code": "47", "label": "Lot-et-Garonne"},
    {"code": "48", "label": "Lozère"},
    {"code": "49", "label": "Maine-et-Loire"},
    {"code": "50", "label": "Manche"},
    {"code": "51", "label": "Marne"},
    {"code": "52", "label": "Haute-Marne"},
    {"code": "53", "label": "Mayenne"},
    {"code": "54", "label": "Meurthe-et-Moselle"},
    {"code": "55", "label": "Meuse"},
    {"code": "56", "label": "Morbihan"},
    {"code": "57", "label": "Moselle"},
    {"code": "58", "label": "Nièvre"},
    {"code": "59", "label": "Nord"},
    {"code": "60", "label": "Oise"},
    {"code": "61", "label": "Orne"},
    {"code": "62", "label": "Pas-de-Calais"},
    {"code": "63", "label": "Puy-de-Dôme"},
    {"code": "64", "label": "Pyrénées-Atlantiques"},
    {"code": "65", "label": "Hautes-Pyrénées"},
    {"code": "66", "label": "Pyrénées-Orientales"},
    {"code": "67", "label": "Bas-Rhin"},
    {"code": "68", "label": "Haut-Rhin"},
    {"code": "69", "label": "Rhône"},
    {"code": "70", "label": "Haute-Saône"},
    {"code": "71", "label": "Saône-et-Loire"},
    {"code": "72", "label": "Sarthe"},
    {"code": "73", "label": "Savoie"},
    {"code": "74", "label": "Haute-Savoie"},
    {"code": "75", "label": "Paris"},
    {"code": "76", "label": "Seine-Maritime"},
    {"code": "77", "label": "Seine-et-Marne"},
    {"code": "78", "label": "Yvelines"},
    {"code": "79", "label": "Deux-Sèvres"},
    {"code": "80", "label": "Somme"},
    {"code": "81", "label": "Tarn"},
    {"code": "82", "label": "Tarn-et-Garonne"},
    {"code": "83", "label": "Var"},
    {"code": "84", "label": "Vaucluse"},
    {"code": "85", "label": "Vendée"},
    {"code": "86", "label": "Vienne"},
    {"code": "87", "label": "Haute-Vienne"},
    {"code": "88", "label": "Vosges"},
    {"code": "89", "label": "Yonne"},
    {"code": "90", "label": "Territoire de Belfort"},
    {"code": "91", "label": "Essonne"},
    {"code": "92", "label": "Hauts-de-Seine"},
    {"code": "93", "label": "Seine-Saint-Denis"},
    {"code": "94", "label": "Val-de-Marne"},
    {"code": "95", "label": "Val-d'Oise"},
    {"code": "971", "label": "Guadeloupe"},
    {"code": "972", "label": "Martinique"},
    {"code": "973", "label": "Guyane"},
    {"code": "974", "label": "La Réunion"},
    {"code": "975", "label": "Saint-Pierre-et-Miquelon"},
    {"code": "976", "label": "Mayotte"},
    {"code": "977", "label": "Saint-Barthélemy"},
    {"code": "978", "label": "Saint-Martin"},
    {"code": "986", "label": "Wallis-et-Futuna"},
    {"code": "987", "label": "Polynésie française"},
    {"code": "988", "label": "Nouvelle-Calédonie"}
  ],
  "lum": [
    {"code": 1, "label": "Plein jour"},
    {"code": 2, "label": "Crépuscule ou aube"},
    {"code": 3, "label": "Nuit sans éclairage public"},
    {"code": 4, "label": "Nuit avec éclairage public non allumé"},
    {"code": 5, "label": "Nuit avec éclairage public allumé"}
  ],
  "atm": [
    {"code": -1, "label": "Non renseigné"},
    {"code": 1, "label": "Normale"},
    {"code": 2, "label": "Pluie légère"},
    {"code": 3, "label": "Pluie forte"},
    {"code": 4, "label": "Neige / grêle"},
    {"code": 5, "label": "Brouillard / fumée"},
    {"code": 6, "label": "Vent fort / tempête"},
    {"code": 7, "label": "Temps éblouissant"},
    {"code": 8, "label": "Temps couvert"},
    {"code": 9, "label": "Autre"}
  ],
  "catr": [
    {"code": 1, "label": "Autoroute"},
    {"code": 2, "label": "Route nationale"},
    {"code": 3, "label": "Route départementale"},
    {"code": 4, "label": "Voie communale"},
    {"code": 5, "label": "Hors réseau public"},
    {"code": 6, "label": "Parc de stationnement ouvert à la circulation publique"},
    {"code": 7, "label": "Routes de métropole urbaine"},
    {"code": 9, "label": "Autre"}
  ],
  "agg": [
    {"code": 1, "label": "Hors agglomération"},
    {"code": 2, "label": "En agglomération"}
  ],
  "int": [
    {"code": 1, "label": "Hors intersection"},
    {"code": 2, "label": "Intersection en X"},
    {"code": 3, "label": "Intersection en T"},
    {"code": 4, "label": "Intersection en Y"},
    {"code": 5, "label": "Intersection à plus de 4 branches"},
    {"code": 6, "label": "Giratoire"},
    {"code": 7, "label": "Place"},
    {"code": 8, "label": "Passage à niveau"},
    {"code": 9, "label": "Autre intersection"}
  ],
  "circ": [
    {"code": -1, "label": "Non renseigné"},
    {"code": 1, "label": "Sens unique"},
    {"code": 2, "label": "Bidirectionnelle"},
    {"code": 3, "label": "Chaussées séparées"},
    {"code": 4, "label": "Voies d'affectation variable"}
  ],
  "col": [
    {"code": -1, "label": "Non renseigné"},
    {"code": 1, "label": "2 véhicules - frontale"},
    {"code": 2, "label": "2 véhicules - par l'arrière"},
    {"code": 3, "label": "2 véhicules - par le côté"},
    {"code": 4, "label": "3+ véhicules - en chaîne"},
    {"code": 5, "label": "3+ véhicules - collisions multiples"},
    {"code": 6, "label": "Autre collision"},
    {"code": 7, "label": "Sans collision"}
  ],
  "vma_bucket": [
    {"code": "<=30", "label": "≤ 30 km/h"},
    {"code": "31-50", "label": "31 à 50 km/h"},
    {"code": "51-80", "label": "51 à 80 km/h"},
    {"code": "81-90", "label": "81 à 90 km/h"},
    {"code": "91-110", "label": "91 à 110 km/h"},
    {"code": "111-130", "label": "111 à 130 km/h"},
    {"code": ">130", "label": "> 130 km/h"},
    {"code": "inconnue", "label": "VMA inconnue / non renseignée"}
  ],
  "catv_family_4": [
    {"code": "voitures_utilitaires", "label": "Voitures particulières + utilitaires légers"},
    {"code": "2rm_3rm", "label": "Deux-roues / trois-roues motorisés"},
    {"code": "lourds_tc_agri_autres", "label": "Poids lourds + transport en commun + agricoles"},
    {"code": "vulnerables", "label": "Usagers/engins vulnérables"}
  ],
  "manv_mode": [
    {"code": -1, "label": "Non renseigné"},
    {"code": 0, "label": "Inconnue"},
    {"code": 1, "label": "Sans changement de direction"},
    {"code": 2, "label": "Même sens, même file"},
    {"code": 3, "label": "Entre 2 files"},
    {"code": 4, "label": "Marche arrière"},
    {"code": 5, "label": "Contresens"},
    {"code": 6, "label": "Franchissant TPC"},
    {"code": 7, "label": "Couloir bus même sens"},
    {"code": 8, "label": "Couloir bus sens inverse"},
    {"code": 9, "label": "S'insérant"},
    {"code": 10, "label": "Demi-tour sur chaussée"},
    {"code": 11, "label": "Change file gauche"},
    {"code": 12, "label": "Change file droite"},
    {"code": 13, "label": "Déporté gauche"},
    {"code": 14, "label": "Déporté droite"},
    {"code": 15, "label": "Tournant gauche"},
    {"code": 16, "label": "Tournant droite"},
    {"code": 17, "label": "Dépassant gauche"},
    {"code": 18, "label": "Dépassant droite"},
    {"code": 19, "label": "Traversant chaussée"},
    {"code": 20, "label": "Stationnement"},
    {"code": 21, "label": "Évitement"},
    {"code": 22, "label": "Ouverture de porte"},
    {"code": 23, "label": "Arrêté (hors stationnement)"},
    {"code": 24, "label": "En stationnement (avec occupants)"},
    {"code": 25, "label": "Circulant sur trottoir"},
    {"code": 26, "label": "Autres manœuvres"}
  ],
  "driver_age_bucket": [
    {"code": "<18", "label": "Moins de 18 ans"},
    {"code": "18-24", "label": "18 à 24 ans"},
    {"code": "25-34", "label": "25 à 34 ans"},
    {"code": "35-44", "label": "35 à 44 ans"},
    {"code": "45-54", "label": "45 à 54 ans"},
    {"code": "55-64", "label": "55 à 64 ans"},
    {"code": "65-74", "label": "65 à 74 ans"},
    {"code": "75+", "label": "75 ans et plus"},
    {"code": "unknown", "label": "Âge inconnu / non renseigné"}
  ],
  "choc_mode": [
    {"code": -1, "label": "Non renseigné"},
    {"code": 0, "label": "Aucun"},
    {"code": 1, "label": "Avant"},
    {"code": 2, "label": "Avant droit"},
    {"code": 3, "label": "Avant gauche"},
    {"code": 4, "label": "Arrière"},
    {"code": 5, "label": "Arrière droit"},
    {"code": 6, "label": "Arrière gauche"},
    {"code": 7, "label": "Côté droit"},
    {"code": 8, "label": "Côté gauche"},